{
  "schema_version": "0.1.0",
  "generated_at": "2026-10-18T00:00:00Z",
  "snapshot_path": "synthetic-snapshot.json",
  "live_source": "synthetic fixture; no server contacted",
  "drift_detected": true,
  "summary": {
    "added": 1,
    "removed": 1,
    "changed": 1,
    "unchanged": 1
  },
  "added_tools": [
    {
      "name": "added",
      "description": "Synthetic fixture tool.",
      "input_schema_hash": "cccccccccccccccccccccccccccccccccccccccccccccccccccccccccccccccc"
    }
  ],
  "removed_tools": [
    {
      "name": "removed",
      "description": "Synthetic fixture tool.",
      "input_schema_hash": "bbbbbbbbbbbbbbbbbbbbbbbbbbbbbbbbbbbbbbbbbbbbbbbbbbbbbbbbbbbbbbbb"
    }
  ],
  "changed_tools": [
    {
      "name": "changed",
      "snapshot": {
        "description": "Synthetic fixture tool.",
        "input_schema_hash": "aaaaaaaaaaaaaaaaaaaaaaaaaaaaaaaaaaaaaaaaaaaaaaaaaaaaaaaaaaaaaaaa"
      },
      "live": {
        "description": "Synthetic fixture tool.",
        "input_schema_hash": "bbbbbbbbbbbbbbbbbbbbbbbbbbbbbbbbbbbbbbbbbbbbbbbbbbbbbbbbbbbbbbbb"
      }
    }
  ],
  "server_id": "synthetic-fixture"
}
